{
  "$schema": "https://json-schema.org/draft/2020-12/schema",
  "$id": "https://dls-lead.local/schemas/component.v1.json",
  "title": "DLS-Lead Component Manifest v1",
  "description": "Machine-readable manifest for a DLS-Lead component. Generated by /build-manifest, validated before commit.",
  "type": "object",
  "required": [
    "name",
    "kebabName",
    "category",
    "description",
    "props",
    "tokens",
    "states",
    "accessibility",
    "figma",
    "_meta"
  ],
  "additionalProperties": false,
  "properties": {
    "name": {
      "type": "string",
      "description": "PascalCase React component name, e.g. 'AccordionItem'."
    },
    "kebabName": {
      "type": "string",
      "pattern": "^[a-z][a-z0-9]*(-[a-z0-9]+)*$",
      "description": "Kebab-case name used in CSS classes, token namespaces, and file paths."
    },
    "category": {
      "type": "string",
      "description": "Primary category from the spec, e.g. 'layout / disclosure', 'action', 'modal / overlay'."
    },
    "subcategory": {
      "type": "string",
      "description": "Optional secondary category for finer grouping."
    },
    "description": {
      "type": "string",
      "description": "One-line description of what the component does and when to use it."
    },
    "subComponents": {
      "type": "array",
      "description": "Other component names exported from the same file (e.g. Accordion exports AccordionItem).",
      "items": { "type": "string" }
    },
    "variants": {
      "type": "array",
      "description": "Variant values exposed via data-variant (e.g. ['filled','outline','ghost']). Empty array if none.",
      "items": { "type": "string" }
    },
    "intents": {
      "type": "array",
      "description": "Intent values exposed via data-intent (e.g. ['neutral','primary','danger']). Empty array if none.",
      "items": { "type": "string" }
    },
    "sizes": {
      "type": "array",
      "description": "Size values exposed via data-size (e.g. ['s','m']). Empty array if none.",
      "items": { "type": "string" }
    },
    "props": {
      "type": "array",
      "description": "All React props from the component's Props interface, in declaration order.",
      "items": { "$ref": "#/$defs/prop" }
    },
    "tokens": {
      "type": "array",
      "description": "CSS custom property names used by this component. Must exist in tokens.json.",
      "items": {
        "type": "string",
        "pattern": "^--dls-"
      }
    },
    "states": {
      "type": "object",
      "description": "Interactive state model for the component.",
      "required": ["available"],
      "additionalProperties": false,
      "properties": {
        "implementation": {
          "type": "string",
          "enum": ["oklch-shift", "overlay", "hybrid", "none"],
          "description": "Which state technique the component uses. 'oklch-shift' = OKLCH L-delta, 'overlay' = rgba overlay tokens, 'hybrid' = both depending on variant, 'none' = no interactive color states."
        },
        "rationale": {
          "type": "string",
          "description": "Why this implementation was chosen (e.g. 'Filled surfaces use OKLCH for perceptual uniformity')."
        },
        "available": {
          "type": "array",
          "description": "CSS pseudo-states and data-attributes the component responds to.",
          "items": { "type": "string" }
        },
        "tokens": {
          "type": "array",
          "description": "State-specific tokens (L3 --dls-state-*, component-scoped color tokens, or component-scoped focus shadow tokens).",
          "items": {
            "type": "string",
            "pattern": "^--dls-(state-|color-component-|shadow-component-|shadow-focus-ring$)"
          }
        }
      }
    },
    "composition": {
      "type": "object",
      "description": "Rules for how this component composes with others.",
      "additionalProperties": false,
      "properties": {
        "allowedChildren": {
          "type": "array",
          "description": "Component names that may appear as direct children.",
          "items": { "type": "string" }
        },
        "forbiddenChildren": {
          "type": "array",
          "description": "Component names that must NOT appear as children.",
          "items": { "type": "string" }
        },
        "forbiddenParents": {
          "type": "array",
          "description": "Component names that must NOT wrap this component.",
          "items": { "type": "string" }
        },
        "maxDepth": {
          "type": "integer",
          "minimum": 1,
          "description": "Maximum nesting depth (e.g. 1 = no nesting)."
        },
        "minItems": {
          "type": "integer",
          "minimum": 0,
          "description": "Minimum number of child items for the component to be meaningful."
        },
        "recommendedItems": {
          "type": "integer",
          "minimum": 1,
          "description": "Recommended number of child items for typical usage."
        }
      }
    },
    "accessibility": {
      "type": "object",
      "description": "Accessibility contract for the component.",
      "required": ["semanticElement"],
      "additionalProperties": false,
      "properties": {
        "semanticElement": {
          "type": "string",
          "description": "The HTML element or ARIA role at the root (e.g. 'button', 'dialog', 'div[role=region]')."
        },
        "requiredAria": {
          "type": "array",
          "description": "ARIA attributes the component must set (e.g. ['aria-expanded', 'aria-controls']).",
          "items": { "type": "string" }
        },
        "keyboard": {
          "type": "object",
          "description": "Keyboard interaction map.",
          "additionalProperties": {
            "type": "string"
          }
        },
        "respectsReducedMotion": {
          "type": "boolean",
          "description": "Whether the component disables/reduces animations under prefers-reduced-motion."
        },
        "focusManagement": {
          "type": "string",
          "description": "How focus is managed (e.g. 'roving tabindex', 'focus trap', 'natural tab order')."
        }
      }
    },
    "figma": {
      "type": "object",
      "description": "Figma design metadata and property mapping.",
      "required": ["componentSetUrl"],
      "additionalProperties": false,
      "properties": {
        "nodeId": {
          "type": "string",
          "description": "Figma node ID (e.g. '6489-1187')."
        },
        "componentSetUrl": {
          "type": "string",
          "format": "uri",
          "description": "Full Figma URL to the component set."
        },
        "propertyMapping": {
          "type": "array",
          "description": "Row-for-row mapping between Figma properties and React props.",
          "items": { "$ref": "#/$defs/figmaPropertyMapping" }
        },
        "componentSets": {
          "type": "array",
          "description": "Optional list of Figma component sets when one React component maps to multiple Figma sets.",
          "items": { "$ref": "#/$defs/figmaComponentSet" }
        }
      }
    },
    "useWhen": {
      "type": "array",
      "description": "Guidance on when to choose this component.",
      "items": { "type": "string" }
    },
    "doNotUseFor": {
      "type": "array",
      "description": "Anti-patterns — situations where this component is the wrong choice.",
      "items": { "type": "string" }
    },
    "relations": {
      "type": "array",
      "description": "Related component names (e.g. 'AlertDialog' relates to 'Dialog').",
      "items": { "type": "string" }
    },
    "knownDeviations": {
      "type": "array",
      "description": "Documented gaps between the code and the ideal system rules.",
      "items": { "$ref": "#/$defs/knownDeviation" }
    },
    "_meta": {
      "type": "object",
      "description": "Generation metadata. Written by the tool, not hand-edited.",
      "required": ["generatedAt", "generator", "sourceHash"],
      "additionalProperties": false,
      "properties": {
        "generatedAt": {
          "type": "string",
          "format": "date-time",
          "description": "ISO 8601 timestamp of generation."
        },
        "generator": {
          "type": "string",
          "description": "Tool identifier, e.g. 'claude-code-manual@1.0.0'."
        },
        "sourceHash": {
          "type": "string",
          "pattern": "^[0-9a-f]{16}$",
          "description": "First 16 hex chars of SHA-256 over (TSX + stories + CSS + spec + tokens.json)."
        }
      }
    }
  },
  "$defs": {
    "prop": {
      "type": "object",
      "required": ["name", "type", "required"],
      "additionalProperties": false,
      "properties": {
        "name": {
          "type": "string",
          "description": "Prop name exactly as declared in the Props interface."
        },
        "type": {
          "type": "string",
          "description": "TypeScript type as a string (e.g. 'string', 'boolean', 'React.ReactNode', '\"s\" | \"m\"')."
        },
        "required": {
          "type": "boolean",
          "description": "True if the prop has no '?' modifier and no default value."
        },
        "default": {
          "description": "Default value from destructuring, if any. Omit if none.",
          "type": ["string", "number", "boolean", "null"]
        },
        "enum": {
          "type": "array",
          "description": "For union-literal types, the individual values.",
          "items": { "type": "string" }
        },
        "description": {
          "type": "string",
          "description": "JSDoc comment on the prop, if present."
        }
      }
    },
    "figmaPropertyMapping": {
      "type": "object",
      "required": ["figmaProperty"],
      "additionalProperties": false,
      "properties": {
        "figmaProperty": {
          "type": "string",
          "description": "Property name as shown in Figma (e.g. 'Show icon', 'State')."
        },
        "reactProp": {
          "type": ["string", "null"],
          "description": "Matching React prop name, or null if no code counterpart."
        },
        "valueMapping": {
          "type": "object",
          "description": "Optional map of Figma value → React value when they differ.",
          "additionalProperties": { "type": "string" }
        },
        "note": {
          "type": "string",
          "description": "Explanation when reactProp is null or the mapping is non-obvious."
        }
      }
    },
    "figmaComponentSet": {
      "type": "object",
      "required": ["name", "nodeId", "componentSetUrl", "propertyMapping"],
      "additionalProperties": false,
      "properties": {
        "name": {
          "type": "string",
          "description": "Figma component set name."
        },
        "nodeId": {
          "type": "string",
          "description": "Figma component set node ID."
        },
        "componentSetUrl": {
          "type": "string",
          "format": "uri",
          "description": "Full Figma URL to the component set."
        },
        "propertyMapping": {
          "type": "array",
          "description": "Property mapping scoped to this component set.",
          "items": { "$ref": "#/$defs/figmaPropertyMapping" }
        }
      }
    },
    "knownDeviation": {
      "type": "object",
      "required": ["area", "description"],
      "additionalProperties": false,
      "properties": {
        "area": {
          "type": "string",
          "description": "Which rule or area is deviated from (e.g. 'icon-source', 'token-layer')."
        },
        "description": {
          "type": "string",
          "description": "What the deviation is and why it exists."
        },
        "severity": {
          "type": "string",
          "enum": ["low", "medium", "high"],
          "description": "Impact severity."
        }
      }
    }
  }
}
